{
  "schema_version": "1.0.0",
  "id": "rules.fixture.1",
  "version": "1.0.0",
  "published_at": "2026-10-16T09:00:00Z",
  "rules": [
    {
      "id": "rule.required.foundation",
      "severity": "error",
      "applies_when": {
        "op": "eq",
        "left": {
          "literal": true
        },
        "right": {
          "literal": true
        }
      },
      "assert": {
        "op": "all",
        "args": [
          {
            "op": "exists",
            "value": {
              "ref": {
                "scope": "selection",
                "kind": "workload",
                "role": "primary",
                "pointer": "/id"
              }
            }
          },
          {
            "op": "exists",
            "value": {
              "ref": {
                "scope": "selection",
                "kind": "deployment_mode",
                "role": "primary",
                "pointer": "/id"
              }
            }
          },
          {
            "op": "exists",
            "value": {
              "ref": {
                "scope": "selection",
                "kind": "model",
                "role": "primary",
                "pointer": "/id"
              }
            }
          },
          {
            "op": "exists",
            "value": {
              "ref": {
                "scope": "selection",
                "kind": "context_policy",
                "role": "primary",
                "pointer": "/id"
              }
            }
          }
        ]
      },
      "on_unknown": "block",
      "message": "Required T0/T1 components are absent.",
      "remediation": "Choose workload, deployment mode, primary model and context.",
      "affected_kinds": [
        "workload",
        "deployment_mode",
        "model",
        "context_policy"
      ],
      "owner": "compatibility-agent"
    },
    {
      "id": "rule.model.provider.match",
      "severity": "error",
      "applies_when": {
        "op": "exists",
        "value": {
          "ref": {
            "scope": "selection",
            "kind": "model",
            "role": "primary",
            "pointer": "/id"
          }
        }
      },
      "assert": {
        "op": "eq",
        "left": {
          "ref": {
            "scope": "catalog",
            "kind": "model",
            "role": "primary",
            "pointer": "/spec/provider_ref"
          }
        },
        "right": {
          "ref": {
            "scope": "selection",
            "kind": "model_provider",
            "role": "primary",
            "pointer": "/catalog_item_id"
          }
        }
      },
      "on_unknown": "block",
      "message": "Selected model belongs to a different provider.",
      "remediation": "Select the corresponding model provider.",
      "affected_kinds": [
        "model",
        "model_provider"
      ],
      "owner": "compatibility-agent"
    },
    {
      "id": "rule.model.context.fit",
      "severity": "error",
      "applies_when": {
        "op": "exists",
        "value": {
          "ref": {
            "scope": "selection",
            "kind": "model",
            "role": "primary",
            "pointer": "/id"
          }
        }
      },
      "assert": {
        "op": "gte",
        "left": {
          "ref": {
            "scope": "catalog",
            "kind": "model",
            "role": "primary",
            "pointer": "/spec/context_window_tokens"
          }
        },
        "right": {
          "metric": "context.total_requested_tokens"
        }
      },
      "on_unknown": "block",
      "message": "Requested total tokens exceed model context capacity.",
      "remediation": "Reduce prompt/reserved output or select a model with a larger context window.",
      "affected_kinds": [
        "model",
        "context_policy",
        "compute_profile"
      ],
      "owner": "compatibility-agent"
    },
    {
      "id": "rule.model.output.limit",
      "severity": "error",
      "applies_when": {
        "op": "exists",
        "value": {
          "ref": {
            "scope": "selection",
            "kind": "model",
            "role": "primary",
            "pointer": "/id"
          }
        }
      },
      "assert": {
        "op": "gte",
        "left": {
          "ref": {
            "scope": "catalog",
            "kind": "model",
            "role": "primary",
            "pointer": "/spec/max_output_tokens"
          }
        },
        "right": {
          "ref": {
            "scope": "selection",
            "kind": "context_policy",
            "role": "primary",
            "pointer": "/settings/reserved_output_tokens"
          }
        }
      },
      "on_unknown": "block",
      "message": "Requested output reservation exceeds model maximum.",
      "remediation": "Reduce reserved output tokens or change model.",
      "affected_kinds": [
        "model",
        "context_policy"
      ],
      "owner": "compatibility-agent"
    },
    {
      "id": "rule.selfhost.requires.infrastructure",
      "severity": "error",
      "applies_when": {
        "op": "eq",
        "left": {
          "ref": {
            "scope": "catalog",
            "kind": "deployment_mode",
            "role": "primary",
            "pointer": "/spec/mode"
          }
        },
        "right": {
          "literal": "self_hosted"
        }
      },
      "assert": {
        "op": "all",
        "args": [
          {
            "op": "exists",
            "value": {
              "ref": {
                "scope": "selection",
                "kind": "hosting_platform",
                "role": "primary",
                "pointer": "/id"
              }
            }
          },
          {
            "op": "exists",
            "value": {
              "ref": {
                "scope": "selection",
                "kind": "accelerator",
                "role": "primary",
                "pointer": "/id"
              }
            }
          },
          {
            "op": "exists",
            "value": {
              "ref": {
                "scope": "selection",
                "kind": "compute_profile",
                "role": "primary",
                "pointer": "/id"
              }
            }
          },
          {
            "op": "exists",
            "value": {
              "ref": {
                "scope": "selection",
                "kind": "inference_engine",
                "role": "primary",
                "pointer": "/id"
              }
            }
          }
        ]
      },
      "on_unknown": "block",
      "message": "Self-hosting requires hosting, compute, accelerator and inference engine.",
      "remediation": "Choose compatible self-hosted infrastructure.",
      "affected_kinds": [
        "deployment_mode",
        "hosting_platform",
        "accelerator",
        "compute_profile",
        "inference_engine"
      ],
      "owner": "compatibility-agent"
    },
    {
      "id": "rule.selfhost.requires.weights",
      "severity": "error",
      "applies_when": {
        "op": "eq",
        "left": {
          "ref": {
            "scope": "catalog",
            "kind": "deployment_mode",
            "role": "primary",
            "pointer": "/spec/mode"
          }
        },
        "right": {
          "literal": "self_hosted"
        }
      },
      "assert": {
        "op": "contains",
        "left": {
          "ref": {
            "scope": "catalog",
            "kind": "model",
            "role": "primary",
            "pointer": "/spec/access_modes"
          }
        },
        "right": {
          "literal": "weights"
        }
      },
      "on_unknown": "block",
      "message": "Model weights are unavailable for self-hosting.",
      "remediation": "Choose a weights-access model or API mode.",
      "affected_kinds": [
        "deployment_mode",
        "model"
      ],
      "owner": "compatibility-agent"
    },
    {
      "id": "rule.engine.model.format",
      "severity": "error",
      "applies_when": {
        "op": "all",
        "args": [
          {
            "op": "eq",
            "left": {
              "ref": {
                "scope": "catalog",
                "kind": "deployment_mode",
                "role": "primary",
                "pointer": "/spec/mode"
              }
            },
            "right": {
              "literal": "self_hosted"
            }
          },
          {
            "op": "exists",
            "value": {
              "ref": {
                "scope": "selection",
                "kind": "inference_engine",
                "role": "primary",
                "pointer": "/id"
              }
            }
          }
        ]
      },
      "assert": {
        "op": "intersects",
        "left": {
          "ref": {
            "scope": "catalog",
            "kind": "model",
            "role": "primary",
            "pointer": "/spec/model_formats"
          }
        },
        "right": {
          "ref": {
            "scope": "catalog",
            "kind": "inference_engine",
            "role": "primary",
            "pointer": "/spec/model_formats"
          }
        }
      },
      "on_unknown": "block",
      "message": "Inference engine cannot load this model format.",
      "remediation": "Change model format or inference engine.",
      "affected_kinds": [
        "model",
        "inference_engine",
        "fine_tuned_model"
      ],
      "owner": "compatibility-agent"
    },
    {
      "id": "rule.engine.accelerator.backend",
      "severity": "error",
      "applies_when": {
        "op": "all",
        "args": [
          {
            "op": "eq",
            "left": {
              "ref": {
                "scope": "catalog",
                "kind": "deployment_mode",
                "role": "primary",
                "pointer": "/spec/mode"
              }
            },
            "right": {